<?xml encoding="UTF-8"?>

<!ELEMENT SYSDATA (BASCI)*>
<!ELEMENT BASIC (LOGOPATH, SYSTEMNAME, PICPATH, CONTACTEXCEL, BOOLVAR*,INTVAR*)>
<!ELEMENT LOGOPATH (#PCDATA)>
<!ELEMENT SYSTEMNAME (#PCDATA)>
<!ELEMENT PICPATH (#PCDATA)>
<!ELEMENT BOOLVAR EMPTY>
<!ELEMENT INTVAR EMPTY>
